Truth,Decoded
Buongiorno io sono Mario,bungioroso sono mario
Prego,prego
Le auguro una buona giornata,leaua euro una lo ora giornata
Buonasera io sono Mario,butntosesrao lo mario
Quanto costa il biglietto,purteo lo lo ponrilioetista
E in offerta costa dieci euro,io offerta lo io lo
"Certo volentieri, io lo prendero macchiato",tutntonrio lo lo pero mario
Perfetto vorrei comprarne due.,puereduvo omane un
Si grazie e arrivederci,tutto aoieto
Tutto bene grazie,tutto bene io
Certo ecco a lei vuole un sacchetto,certo lo lo vuole un certo
Prendiamo un caffe al bar,pruono lo lo lo bar
Purtroppo non lo so pero potresti chiedere all autista,purtroppo lo lo so lo lo lo sroshie erire lo lo autista
Salve quanto costa quell articolo,preaieuio
Tutto bene tu,tutto bene tu
Buongiorno io sono Mario,buonionionrnio sono mario
